{"bwrap_options":["--unshare-user","--unshare-all","--disable-userns","--assert-userns-disabled","--die-with-parent","--new-session","--clearenv","--cap-drop","ALL"],"candidate_mount":"/candidate","candidate_package_version":"0.3.9","deadline_seconds":900,"environment":[{"name":"HOME","value":"/work/home"},{"name":"LANG","value":"C.UTF-8"},{"name":"LC_ALL","value":"C.UTF-8"},{"name":"PATH","value":""},{"name":"PWD","value":"/candidate"},{"name":"PYTEST_DISABLE_PLUGIN_AUTOLOAD","value":"1"},{"name":"PYTHONDONTWRITEBYTECODE","value":"1"},{"name":"PYTHONHASHSEED","value":"0"},{"name":"QUARRY_OFFLINE_CI","value":"1"},{"name":"TMPDIR","value":"/work/tmp"},{"name":"XDG_CACHE_HOME","value":"/work/xdg-cache"},{"name":"XDG_CONFIG_HOME","value":"/work/xdg-config"},{"name":"XDG_DATA_HOME","value":"/work/xdg-data"}],"fallback":"none","hostname":"quarry-h0-development","isolation":{"candidate_mount":"read-only-bind-fd","candidate_tree":"regular-utf8-blobs-only-no-gitlinks-no-symlinks","dev":"new-isolated-dev","network":"unshared","proc":"new-read-only-procfs","report_channel":"parent-owned-canonical-json-pipe-closed-before-pytest","root":"blank-tmpfs","seccomp":"none-development-diagnostic","work_mount":"read-write-bind-fd"},"lane":"H0-hermetic","limits":{"bwrap_status_bytes":65536,"command_output_bytes":1048576,"isolation_report_bytes":65536,"log_bytes_per_stream":2097152},"mode":"collect-only-development-host-runtime","publication":"external-disjoint-create-only-0600-fsync-nonauthoritative-summary-last","pytest_arguments":["-p","no:cacheprovider","--collect-only","-q","-m","offline","--strict-markers","--quarry-taxonomy-manifest","/work/taxonomy.json","/candidate/tests"],"python_arguments":["-I","-B","/candidate/src/quarry_recon/release_h0_inner.py"],"reason":"non-nominated 0.3.9/development host runtime","release":"0.3.10","runtime_mounts":[{"destination":"/usr","source":"/usr","trust":"untrusted-host-runtime-exec-closure"}],"runtime_symlinks":[{"destination":"/bin","target":"usr/bin"},{"destination":"/lib","target":"usr/lib"},{"destination":"/lib64","target":"usr/lib64"}],"schema_version":"quarry.h0-development-profile.v1","scratch":{"disjoint_from":["output","source"],"parent":"/tmp","parent_mode":"01777-root-owned-sticky","private_mode":"0700"},"status":"open","work_mount":"/work"}
